{
  "manifest_version": "0.1",
  "kind": "known-issues-runtime-mapping",
  "state": "reviewed_inventory",
  "source_semantic_registry": {
    "path": "audit_registry/finding_semantic_classification_v0.1.json",
    "git_blob": "c6ebd6e456491e17807e8349c709f5025a0090ff",
    "classification_state": "complete",
    "finding_count": 192
  },
  "source_frozen_baseline": {
    "path": "audit_registry/finding_provenance_baseline_2026-09-14.json",
    "baseline_payload_sha256": "d5bf14df302d57a0fc3d71792e1cb00583fafd3e9c7efd19721fd0de353dd576"
  },
  "policy": {
    "normative_xsd_result_must_not_be_overridden": true,
    "generated_only_from_runtime_match_reviewed": true,
    "trigger_descriptions_are_not_executable_matchers": true,
    "implementation_requires_separate_profile_specific_validation": true
  },
  "counts": {
    "reviewed_mapping_count": 77,
    "implemented_count": 0,
    "semantic_candidate_count": 0,
    "semantic_not_designed_count": 0,
    "semantic_not_applicable_count": 115
  },
  "mappings": [
    {
      "finding_id": "ARA-001",
      "service": "AnalogRadioService",
      "semantic_issue_kind": "release_authority_gap",
      "sdk_behavior": "unsupported_profile",
      "activation_class": "profile_resolution_failure",
      "required_precondition": "strict_profile_resolution_failed",
      "result_effect": "emit_unsupported_profile",
      "implementation_state": "reviewed_not_implemented",
      "authority_guard": "selected_xsd_result_remains_normative",
      "profile_scope": [
        {
          "version": "V2.4",
          "authority": "unresolved",
          "xsd_profile": null,
          "note": "An official V2.4 PDF exists, but no official VDV-301-2.4 release tag or official upstream AnalogRadioService V2.4 XSD was found."
        },
        {
          "version": "V2.4 candidate/integration",
          "authority": "candidate_integration",
          "xsd_profile": "IBIS-IP_AnalogRadioService_V2.4.xsd",
          "note": "Candidate/integration material exists but is not official release authority."
        }
      ],
      "trigger_descriptions": [
        "requested strict profile is AnalogRadioService V2.4",
        "no official release-tagged V2.4 XSD authority can be selected"
      ],
      "diagnostic_source": {
        "registry": "audit_registry/finding_semantic_classification_v0.1.json",
        "finding_id": "ARA-001"
      }
    },
    {
      "finding_id": "ARA-003",
      "service": "AnalogRadioService",
      "semantic_issue_kind": "cardinality_mismatch",
      "sdk_behavior": "info",
      "activation_class": "informational",
      "required_precondition": "informational_context_matched",
      "result_effect": "emit_info",
      "implementation_state": "reviewed_not_implemented",
      "authority_guard": "selected_xsd_result_remains_normative",
      "profile_scope": [
        {
          "version": "V2.4",
          "authority": "documentation_only",
          "xsd_profile": null,
          "note": "The official PDF table states 1:1 while its embedded schema view shows the element as optional."
        },
        {
          "version": "V2.4 candidate/integration",
          "authority": "candidate_integration",
          "xsd_profile": "IBIS-IP_AnalogRadioService_V2.4.xsd",
          "note": "EV-105 confirms omission and presence are both valid in candidate/integration material; this is not official release conformance."
        }
      ],
      "trigger_descriptions": [
        "explicitly selected candidate/integration profile AnalogRadioService V2.4",
        "candidate XSD validation result is VALID for AnalogRadioService.SendTelegram",
        "RadioTelegramStructure omits Transmitter"
      ],
      "diagnostic_source": {
        "registry": "audit_registry/finding_semantic_classification_v0.1.json",
        "finding_id": "ARA-003"
      }
    },
    {
      "finding_id": "ARA-004",
      "service": "AnalogRadioService",
      "semantic_issue_kind": "wrong_operation_reference",
      "sdk_behavior": "warning",
      "activation_class": "resolver_or_profile_warning",
      "required_precondition": "resolver_context_matched",
      "result_effect": "emit_warning",
      "implementation_state": "reviewed_not_implemented",
      "authority_guard": "selected_xsd_result_remains_normative",
      "profile_scope": [
        {
          "version": "V2.4",
          "authority": "documentation_only",
          "xsd_profile": null,
          "note": "The inconsistency is fully established within the official PDF."
        }
      ],
      "trigger_descriptions": [
        "service/document context is AnalogRadioService V2.4",
        "observed URI or configured operation path uses the exact operation segment SendFFSKTelegram",
        "emit guidance for SendTelegram without accepting, rewriting, or registering SendFFSKTelegram as an alias"
      ],
      "diagnostic_source": {
        "registry": "audit_registry/finding_semantic_classification_v0.1.json",
        "finding_id": "ARA-004"
      }
    },
    {
      "finding_id": "BG-001",
      "service": "BaseGeneral",
      "semantic_issue_kind": "version_routing_issue",
      "sdk_behavior": "warning",
      "activation_class": "resolver_or_profile_warning",
      "required_precondition": "resolver_context_matched",
      "result_effect": "emit_warning",
      "implementation_state": "reviewed_not_implemented",
      "authority_guard": "selected_xsd_result_remains_normative",
      "profile_scope": [
        {
          "version": "VDV-301-1.0 historical V1.0 service pool",
          "authority": "official_release",
          "xsd_profile": "exact release-tag-selected service XSD pool",
          "note": "Baseline release context: JIS/PCS/SystemManagement/TicketInformation V1.0 paths use the original official blobs."
        },
        {
          "version": "VDV-301-2.0 historical V1.0 service pool",
          "authority": "official_release",
          "xsd_profile": "exact release-tag-selected service XSD pool",
          "note": "All four same-path V1.0 service XSDs use different official blobs than VDV-301-1.0."
        },
        {
          "version": "VDV-301-2.1 retained historical V1.0 service pool",
          "authority": "official_release",
          "xsd_profile": "exact release-tag-selected service XSD pool",
          "note": "JIS, SystemManagement and TicketInformation V1.0 remain present with the VDV-301-2.0 blobs; PassengerCountingService V1.0 is no longer present."
        },
        {
          "version": "VDV-301-2.2 retained historical V1.0 service pool",
          "authority": "official_release",
          "xsd_profile": "exact release-tag-selected service XSD pool",
          "note": "JIS and TicketInformation V1.0 remain present with the VDV-301-2.0 blobs; PassengerCountingService and SystemManagementService V1.0 are no longer present."
        },
        {
          "version": "VDV-301-2.3 retained historical V1.0 service pool",
          "authority": "official_release",
          "xsd_profile": "exact release-tag-selected service XSD pool",
          "note": "JIS and TicketInformation V1.0 remain present with the VDV-301-2.0 blobs through the latest official VDV-301-2.3 release; the other two paths are absent."
        }
      ],
      "trigger_descriptions": [
        "historical V1.0 validation profile selected without an exact official release-tag context",
        "schema dependencies from different official release contexts VDV-301-1.0 through VDV-301-2.3 are mixed",
        "a same-named V1.0 XSD from another release context is substituted for the selected historical pool"
      ],
      "diagnostic_source": {
        "registry": "audit_registry/finding_semantic_classification_v0.1.json",
        "finding_id": "BG-001"
      }
    },
    {
      "finding_id": "CE-004",
      "service": "Common/Enumerations",
      "semantic_issue_kind": "stale_identifier_after_rename",
      "sdk_behavior": "error_with_advisory",
      "activation_class": "xsd_invalid_advisory",
      "required_precondition": "xsd_result_invalid",
      "result_effect": "decorate_existing_invalid",
      "implementation_state": "reviewed_not_implemented",
      "authority_guard": "selected_xsd_result_remains_normative",
      "profile_scope": [
        {
          "version": "Enumerations V2.2-V2.3",
          "authority": "official_release",
          "xsd_profile": "IBIS-IP_Enumerations_V2.2.xsd",
          "note": "The stale ServiceNameEnumeration table begins in V2.2; the official V2.3 Common dependency route reuses the exact Enumerations V2.2 pool."
        },
        {
          "version": "Enumerations V2.4",
          "authority": "candidate_integration",
          "xsd_profile": "IBIS-IP_Enumerations_V2.4.xsd",
          "note": "The official V2.4 PDF still carries the stale names; the selected V2.4 XSD is candidate/integration authority only."
        }
      ],
      "trigger_descriptions": [
        "ServiceName value SystemDocumentationService",
        "ServiceName value SystemManagementService"
      ],
      "diagnostic_source": {
        "registry": "audit_registry/finding_semantic_classification_v0.1.json",
        "finding_id": "CE-004"
      }
    },
    {
      "finding_id": "CE-005",
      "service": "Common/Enumerations",
      "semantic_issue_kind": "cardinality_mismatch",
      "sdk_behavior": "error_with_advisory",
      "activation_class": "xsd_invalid_advisory",
      "required_precondition": "xsd_result_invalid",
      "result_effect": "decorate_existing_invalid",
      "implementation_state": "reviewed_not_implemented",
      "authority_guard": "selected_xsd_result_remains_normative",
      "profile_scope": [
        {
          "version": "Common V2.0-V2.3",
          "authority": "official_release",
          "xsd_profile": "exact selected Common XSD per version",